{
  "beans": [
    {
      "defaultBean": true,
      "dependencies": [],
      "id": "@reforce/logging#DefaultLoggingSettings",
      "provides": ["@reforce/logging#DefaultLoggingSettings", "@reforce/logging#LoggingSettings"],
      "runtimeExport": {
        "export": "DefaultLoggingSettings",
        "module": "@reforce/logging"
      },
      "source": {
        "end": {
          "character": 65,
          "line": 31,
          "offset": 1198
        },
        "file": "src/settings.ts",
        "start": {
          "character": 7,
          "line": 31,
          "offset": 1140
        }
      }
    },
    {
      "defaultBean": true,
      "dependencies": [
        {
          "contract": "@reforce/logging#LoggingSettings",
          "open": true
        },
        {
          "contract": "@reforce/logging#LoggerLevels",
          "open": true
        },
        {
          "collection": true,
          "contract": "@reforce/logging#LogFieldSource",
          "open": true
        }
      ],
      "id": "@reforce/logging#DefaultLoggingFactory",
      "provides": ["@reforce/logging#DefaultLoggingFactory", "@reforce/logging#LoggerFactory"],
      "runtimeExport": {
        "export": "DefaultLoggingFactory",
        "module": "@reforce/logging"
      },
      "source": {
        "end": {
          "character": 1,
          "line": 24,
          "offset": 1166
        },
        "file": "src/generated-runtime.ts",
        "start": {
          "character": 7,
          "line": 16,
          "offset": 932
        }
      }
    }
  ],
  "schemaVersion": 1,
  "starterDeps": [],
  "symbols": [
    {
      "file": "dist/generated-runtime.d.ts",
      "id": "@reforce/logging#DefaultLoggingFactory",
      "subpaths": [".", "./generated-runtime"]
    },
    {
      "file": "dist/settings.d.ts",
      "id": "@reforce/logging#DefaultLoggingSettings",
      "subpaths": ["."]
    },
    {
      "file": "dist/contracts.d.ts",
      "id": "@reforce/logging#LogFieldSource",
      "subpaths": ["."]
    },
    {
      "file": "dist/contracts.d.ts",
      "id": "@reforce/logging#LoggerFactory",
      "subpaths": ["."]
    },
    {
      "file": "dist/levels.d.ts",
      "id": "@reforce/logging#LoggerLevels",
      "subpaths": ["."]
    },
    {
      "file": "dist/settings.d.ts",
      "id": "@reforce/logging#LoggingSettings",
      "subpaths": ["."]
    }
  ]
}
